{
  "model_version": "0.1.0",
  "model_family": "inc15c2-dhs-original-chart-boxes",
  "source_id": "CENSUS-SRC-DHS-CHART-2025",
  "source_snapshot_id": "CENSUS-SNAPSHOT-DHS-CHART-2025",
  "source_publisher": "U.S. Department of Homeland Security",
  "source_report_title": "DHS FY2024 Annual Performance Report",
  "source_claimed_publication_date": "2025-01-17",
  "captured_official_url": "https://www.dhs.gov/sites/default/files/2025-02/2025_0117_dhs_annual_performance_report_fy2024.pdf",
  "source_retrieved_at_utc": "2026-10-21T01:18:06.338Z",
  "source_original_git_path": "evidence/dhs-fy2024/originals/sha256/d48f661bf9d6643409585451a2dc49f53358fe869dd40d182344f0bed58e4175.pdf",
  "source_original_sha256": "d48f661bf9d6643409585451a2dc49f53358fe869dd40d182344f0bed58e4175",
  "source_original_git_blob_sha": "bdbcbc4a6045eebef852daeceeb154be15c48684",
  "source_original_bytes": 17622005,
  "pdf_metadata_creation_utc": "2025-01-16T13:57:53Z",
  "pdf_metadata_modified_utc": "2025-02-04T13:53:52Z",
  "source_figure": "Figure 1: DHS Organizational Chart",
  "printed_page_number": 24,
  "physical_pdf_page_number": 24,
  "chart_scope_statement": "This chart shows how DHS, its Components, and a majority of our key offices are organized.",
  "figure_box_count": 34,
  "legend_box_count_excluded": 3,
  "office_secretary_executive_boxes": 13,
  "operational_component_boxes": 8,
  "support_and_oversight_boxes": 13,
  "prior_research_candidate_boxes_reconciled": 10,
  "previously_unmodeled_chart_boxes": 24,
  "complete_source_figure_box_enumeration_reviewed": true,
  "complete_current_DHS_institutional_census": false,
  "current_DHS_first_level_denominator": null,
  "independent_WORM_custody_verified": false,
  "independent_legal_review_complete": false,
  "adl1_certified_count": 0,
  "no_new_current_canonical_institution_ids": true,
  "items": [
    {
      "id": "INC15C2-BOX-01-EXECUTIVE-SECRETARY",
      "type": "source_bounded_pdf_org_chart_box",
      "figure_order": 1,
      "chart_label": "Executive Secretary",
      "chart_legend_class": "office_secretary_executive",
      "printed_page": 24,
      "physical_pdf_page": 24,
      "box_top_left_x_pt": 510.52,
      "box_top_left_y_pt": 196.82,
      "contains_multiple_office_titles": false,
      "source_footnote_marker": null,
      "prior_inc15c1_candidate_id": null,
      "prior_inc12_observation_id": null,
      "prior_descriptive_relation_id": null,
      "source_only_unratified_candidate": true,
      "independent_oversight_exception": false,
      "conditional_coast_guard_military_placement": false,
      "source_descriptive_chart_placement_only": true,
      "current_authority_verified": false,
      "operational_command_verified": false,
      "statutory_delegation_verified": false,
      "independent_legal_review_complete": false,
      "adl1_certified": false
    },
    {
      "id": "INC15C2-BOX-02-SECRETARY-DEPUTY-SECRETARY",
      "type": "source_bounded_pdf_org_chart_box",
      "figure_order": 2,
      "chart_label": "Secretary / Deputy Secretary",
      "chart_legend_class": "office_secretary_executive",
      "printed_page": 24,
      "physical_pdf_page": 24,
      "box_top_left_x_pt": 245.14,
      "box_top_left_y_pt": 209.57,
      "contains_multiple_office_titles": true,
      "source_footnote_marker": null,
      "prior_inc15c1_candidate_id": null,
      "prior_inc12_observation_id": null,
      "prior_descriptive_relation_id": null,
      "source_only_unratified_candidate": true,
      "independent_oversight_exception": false,
      "conditional_coast_guard_military_placement": false,
      "source_descriptive_chart_placement_only": true,
      "current_authority_verified": false,
      "operational_command_verified": false,
      "statutory_delegation_verified": false,
      "independent_legal_review_complete": false,
      "adl1_certified": false
    },
    {
      "id": "INC15C2-BOX-03-CHIEF-OF-STAFF",
      "type": "source_bounded_pdf_org_chart_box",
      "figure_order": 3,
      "chart_label": "Chief of Staff",
      "chart_legend_class": "office_secretary_executive",
      "printed_page": 24,
      "physical_pdf_page": 24,
      "box_top_left_x_pt": 393.57,
      "box_top_left_y_pt": 223.8,
      "contains_multiple_office_titles": false,
      "source_footnote_marker": null,
      "prior_inc15c1_candidate_id": null,
      "prior_inc12_observation_id": null,
      "prior_descriptive_relation_id": null,
      "source_only_unratified_candidate": true,
      "independent_oversight_exception": false,
      "conditional_coast_guard_military_placement": false,
      "source_descriptive_chart_placement_only": true,
      "current_authority_verified": false,
      "operational_command_verified": false,
      "statutory_delegation_verified": false,
      "independent_legal_review_complete": false,
      "adl1_certified": false
    },
    {
      "id": "INC15C2-BOX-04-MILITARY-ADVISOR",
      "type": "source_bounded_pdf_org_chart_box",
      "figure_order": 4,
      "chart_label": "Military Advisor",
      "chart_legend_class": "office_secretary_executive",
      "printed_page": 24,
      "physical_pdf_page": 24,
      "box_top_left_x_pt": 510.52,
      "box_top_left_y_pt": 223.8,
      "contains_multiple_office_titles": false,
      "source_footnote_marker": null,
      "prior_inc15c1_candidate_id": null,
      "prior_inc12_observation_id": null,
      "prior_descriptive_relation_id": null,
      "source_only_unratified_candidate": true,
      "independent_oversight_exception": false,
      "conditional_coast_guard_military_placement": false,
      "source_descriptive_chart_placement_only": true,
      "current_authority_verified": false,
      "operational_command_verified": false,
      "statutory_delegation_verified": false,
      "independent_legal_review_complete": false,
      "adl1_certified": false
    },
    {
      "id": "INC15C2-BOX-05-COUNTERTERRORISM-COORDINATOR",
      "type": "source_bounded_pdf_org_chart_box",
      "figure_order": 5,
      "chart_label": "Counterterrorism Coordinator",
      "chart_legend_class": "office_secretary_executive",
      "printed_page": 24,
      "physical_pdf_page": 24,
      "box_top_left_x_pt": 510.52,
      "box_top_left_y_pt": 250.8,
      "contains_multiple_office_titles": false,
      "source_footnote_marker": null,
      "prior_inc15c1_candidate_id": null,
      "prior_inc12_observation_id": null,
      "prior_descriptive_relation_id": null,
      "source_only_unratified_candidate": true,
      "independent_oversight_exception": false,
      "conditional_coast_guard_military_placement": false,
      "source_descriptive_chart_placement_only": true,
      "current_authority_verified": false,
      "operational_command_verified": false,
      "statutory_delegation_verified": false,
      "independent_legal_review_complete": false,
      "adl1_certified": false
    },
    {
      "id": "INC15C2-BOX-06-CIVIL-RIGHTS-CIVIL-LIBERTIES",
      "type": "source_bounded_pdf_org_chart_box",
      "figure_order": 6,
      "chart_label": "Office for Civil Rights and Civil Liberties",
      "chart_legend_class": "office_secretary_executive",
      "printed_page": 24,
      "physical_pdf_page": 24,
      "box_top_left_x_pt": 18,
      "box_top_left_y_pt": 304.77,
      "contains_multiple_office_titles": false,
      "source_footnote_marker": null,
      "prior_inc15c1_candidate_id": null,
      "prior_inc12_observation_id": null,
      "prior_descriptive_relation_id": null,
      "source_only_unratified_candidate": true,
      "independent_oversight_exception": false,
      "conditional_coast_guard_military_placement": false,
      "source_descriptive_chart_placement_only": true,
      "current_authority_verified": false,
      "operational_command_verified": false,
      "statutory_delegation_verified": false,
      "independent_legal_review_complete": false,
      "adl1_certified": false
    },
    {
      "id": "INC15C2-BOX-07-GENERAL-COUNSEL",
      "type": "source_bounded_pdf_org_chart_box",
      "figure_order": 7,
      "chart_label": "Office of the General Counsel",
      "chart_legend_class": "office_secretary_executive",
      "printed_page": 24,
      "physical_pdf_page": 24,
      "box_top_left_x_pt": 116.2,
      "box_top_left_y_pt": 304.77,
      "contains_multiple_office_titles": false,
      "source_footnote_marker": null,
      "prior_inc15c1_candidate_id": null,
      "prior_inc12_observation_id": null,
      "prior_descriptive_relation_id": null,
      "source_only_unratified_candidate": true,
      "independent_oversight_exception": false,
      "conditional_coast_guard_military_placement": false,
      "source_descriptive_chart_placement_only": true,
      "current_authority_verified": false,
      "operational_command_verified": false,
      "statutory_delegation_verified": false,
      "independent_legal_review_complete": false,
      "adl1_certified": false
    },
    {
      "id": "INC15C2-BOX-08-LEGISLATIVE-AFFAIRS",
      "type": "source_bounded_pdf_org_chart_box",
      "figure_order": 8,
      "chart_label": "Office of Legislative Affairs",
      "chart_legend_class": "office_secretary_executive",
      "printed_page": 24,
      "physical_pdf_page": 24,
      "box_top_left_x_pt": 215.16,
      "box_top_left_y_pt": 304.77,
      "contains_multiple_office_titles": false,
      "source_footnote_marker": null,
      "prior_inc15c1_candidate_id": null,
      "prior_inc12_observation_id": null,
      "prior_descriptive_relation_id": null,
      "source_only_unratified_candidate": true,
      "independent_oversight_exception": false,
      "conditional_coast_guard_military_placement": false,
      "source_descriptive_chart_placement_only": true,
      "current_authority_verified": false,
      "operational_command_verified": false,
      "statutory_delegation_verified": false,
      "independent_legal_review_complete": false,
      "adl1_certified": false
    },
    {